{"$schema":"https://json-schema.org/draft/2020-12/schema","$id":"https://schemas.mackysoft.dev/ucli/schema-manifest.schema.json","x-contract-id":"ucli.schema/schema.manifest","x-contract-digest":"cafeb60d75af35d3eff2dc059461abab380d65cb0a5fd932e9e175dab8ae21f9","title":"uCLI static schema manifest","description":"Indexes the exact static JSON Schema files distributed with the installed uCLI package.","type":"object","properties":{"schemaSet":{"description":"Fixed identifier for the uCLI static schema set.","type":"string","const":"ucli"},"packageVersion":{"description":"Version of the MackySoft.Ucli package that carries this schema set.","type":"string"},"protocolVersion":{"description":"IPC and public execution-result protocol version implemented by the same uCLI package.","type":"integer","minimum":-2147483648,"maximum":2147483647},"jsonSchemaDialect":{"description":"JSON Schema dialect used by every document in the set.","type":"string","const":"https://json-schema.org/draft/2020-12/schema"},"schemas":{"description":"Schema entries ordered by logical name using Unicode code-point order.","type":"array","items":{"$ref":"#/$defs/d0"}}},"required":["schemaSet","packageVersion","protocolVersion","jsonSchemaDialect","schemas"],"additionalProperties":false,"$defs":{"d0":{"description":"Identifies one static JSON Schema document and its delivery relationships.","type":"object","properties":{"name":{"description":"Stable logical name used by ucli schema get.","type":"string","minLength":1,"maxLength":256},"kind":{"description":"Delivery and validation responsibility of the schema document.","type":"string","enum":["cliOutputEnvelope","cliOutputPayload","commonDefinition","schemaSetMetadata","userInputDocument"]},"path":{"description":"Normalized slash-separated path relative to the static schema-set root.","type":"string","minLength":1,"maxLength":512},"$id":{"description":"Canonical identifier that exactly matches the schema document\u0027s $id.","type":"string"},"sha256":{"description":"SHA-256 of the exact schema file bytes as 64 lowercase hexadecimal characters.","type":"string","minLength":64,"maxLength":64,"pattern":"^[0-9a-f]{64}$"},"command":{"description":"Matching CommandResult command for a CLI output payload schema; null for other kinds.","type":["string","null"]},"status":{"description":"Matching CommandResult status for a CLI output payload schema; null for other kinds.","type":["string","null"],"enum":["error","ok",null]},"usages":{"description":"Public command delivery sites for user-authored documents.","type":"array","items":{"$ref":"#/$defs/d1"}},"staticDependencies":{"description":"Logical names of directly required documents in the same static schema set.","type":"array","items":{"type":"string"}},"dynamicValidationSources":{"description":"Public catalog commands used for dynamic validation after static structure validation.","type":"array","items":{"type":"string"}}},"required":["name","kind","path","$id","sha256","command","status","usages","staticDependencies","dynamicValidationSources"],"additionalProperties":false},"d1":{"description":"Describes one public command delivery site for a user-authored JSON document.","type":"object","properties":{"command":{"description":"Public command that consumes or creates the document.","type":"string","minLength":1,"maxLength":256},"delivery":{"description":"Method by which the command consumes or creates the document.","type":"string","enum":["fixedProjectPath","generatedFile","generatedFixedProjectPath","optionFile","standardInput"]},"locator":{"description":"Option name or fixed relative path used to locate the document; null for standard input.","type":["string","null"]}},"required":["command","delivery","locator"],"additionalProperties":false}}}