{
  "schemaSet": "ucli",
  "packageVersion": "0.0.0",
  "protocolVersion": 1,
  "jsonSchemaDialect": "https://json-schema.org/draft/2020-12/schema",
  "schemas": [
    {
      "name": "cli-output.envelope",
      "kind": "cliOutputEnvelope",
      "path": "cli-output/envelope.schema.json",
      "$id": "https://schemas.mackysoft.dev/ucli/cli-output/envelope.schema.json",
      "sha256": "b8bb3836232af192df160a92d822230373eabcb5caeaf9765354888b8fb2f956",
      "command": null,
      "status": null,
      "usages": [],
      "staticDependencies": [],
      "dynamicValidationSources": []
    },
    {
      "name": "cli-output.payload.build.error",
      "kind": "cliOutputPayload",
      "path": "cli-output/payload/build.error.schema.json",
      "$id": "https://schemas.mackysoft.dev/ucli/cli-output/payload/build.error.schema.json",
      "sha256": "5ce1c20a8afdb53c554b3b14a97710303dd55e9af1835e53bf4f3fd126fec895",
      "command": "build",
      "status": "error",
      "usages": [],
      "staticDependencies": [],
      "dynamicValidationSources": []
    },
    {
      "name": "cli-output.payload.build.run.error",
      "kind": "cliOutputPayload",
      "path": "cli-output/payload/build.run.error.schema.json",
      "$id": "https://schemas.mackysoft.dev/ucli/cli-output/payload/build.run.error.schema.json",
      "sha256": "2f2123881b015196a3c83a7c1a9ae3052ba55e162ede66b34ed31e261e000c07",
      "command": "build.run",
      "status": "error",
      "usages": [],
      "staticDependencies": [],
      "dynamicValidationSources": []
    },
    {
      "name": "cli-output.payload.build.run.ok",
      "kind": "cliOutputPayload",
      "path": "cli-output/payload/build.run.ok.schema.json",
      "$id": "https://schemas.mackysoft.dev/ucli/cli-output/payload/build.run.ok.schema.json",
      "sha256": "81ddd4aec2a6615ce56ab3d4c4dedea58c5c7b41d0cf67e03e5250202b93c6b2",
      "command": "build.run",
      "status": "ok",
      "usages": [],
      "staticDependencies": [],
      "dynamicValidationSources": []
    },
    {
      "name": "cli-output.payload.call.error",
      "kind": "cliOutputPayload",
      "path": "cli-output/payload/call.error.schema.json",
      "$id": "https://schemas.mackysoft.dev/ucli/cli-output/payload/call.error.schema.json",
      "sha256": "9bca1303f177588c598147d33a4e76521abaa1207a5fcd4bf544b8f4dce2625c",
      "command": "call",
      "status": "error",
      "usages": [],
      "staticDependencies": [],
      "dynamicValidationSources": []
    },
    {
      "name": "cli-output.payload.call.ok",
      "kind": "cliOutputPayload",
      "path": "cli-output/payload/call.ok.schema.json",
      "$id": "https://schemas.mackysoft.dev/ucli/cli-output/payload/call.ok.schema.json",
      "sha256": "323453a560381b5309d97506736fe91f444d8ddacbc0dc0b25c86fdd30c4363a",
      "command": "call",
      "status": "ok",
      "usages": [],
      "staticDependencies": [],
      "dynamicValidationSources": []
    },
    {
      "name": "cli-output.payload.codes.describe.error",
      "kind": "cliOutputPayload",
      "path": "cli-output/payload/codes.describe.error.schema.json",
      "$id": "https://schemas.mackysoft.dev/ucli/cli-output/payload/codes.describe.error.schema.json",
      "sha256": "4c3df18ebb5ab1da21c34aa02846ce92122d089aecba4e75378671efa823f62e",
      "command": "codes.describe",
      "status": "error",
      "usages": [],
      "staticDependencies": [],
      "dynamicValidationSources": []
    },
    {
      "name": "cli-output.payload.codes.describe.ok",
      "kind": "cliOutputPayload",
      "path": "cli-output/payload/codes.describe.ok.schema.json",
      "$id": "https://schemas.mackysoft.dev/ucli/cli-output/payload/codes.describe.ok.schema.json",
      "sha256": "38ded6387ca7cd8093bf4c1aa75ca74da55b6f63fb6ae460632db2f8f2fd50ce",
      "command": "codes.describe",
      "status": "ok",
      "usages": [],
      "staticDependencies": [],
      "dynamicValidationSources": []
    },
    {
      "name": "cli-output.payload.codes.error",
      "kind": "cliOutputPayload",
      "path": "cli-output/payload/codes.error.schema.json",
      "$id": "https://schemas.mackysoft.dev/ucli/cli-output/payload/codes.error.schema.json",
      "sha256": "c7434c88fea5fa31513da8ab4b885e4ab7ad655c592dc3dffc044de8693fe882",
      "command": "codes",
      "status": "error",
      "usages": [],
      "staticDependencies": [],
      "dynamicValidationSources": []
    },
    {
      "name": "cli-output.payload.codes.list.error",
      "kind": "cliOutputPayload",
      "path": "cli-output/payload/codes.list.error.schema.json",
      "$id": "https://schemas.mackysoft.dev/ucli/cli-output/payload/codes.list.error.schema.json",
      "sha256": "9521978f0a4f40731cda79a990cdd6e8b603ddba3c38b5714f48ec7aa04897aa",
      "command": "codes.list",
      "status": "error",
      "usages": [],
      "staticDependencies": [],
      "dynamicValidationSources": []
    },
    {
      "name": "cli-output.payload.codes.list.ok",
      "kind": "cliOutputPayload",
      "path": "cli-output/payload/codes.list.ok.schema.json",
      "$id": "https://schemas.mackysoft.dev/ucli/cli-output/payload/codes.list.ok.schema.json",
      "sha256": "33f893e6083b5ef04c85b2cfe2a1b0b15a64624024bb4f359cd17c86fc6d7720",
      "command": "codes.list",
      "status": "ok",
      "usages": [],
      "staticDependencies": [],
      "dynamicValidationSources": []
    },
    {
      "name": "cli-output.payload.compile.error",
      "kind": "cliOutputPayload",
      "path": "cli-output/payload/compile.error.schema.json",
      "$id": "https://schemas.mackysoft.dev/ucli/cli-output/payload/compile.error.schema.json",
      "sha256": "829cd6d762efe0c444bd054383ae0354dcb74e3c3c6d9630f08faba28817ec8d",
      "command": "compile",
      "status": "error",
      "usages": [],
      "staticDependencies": [],
      "dynamicValidationSources": []
    },
    {
      "name": "cli-output.payload.compile.ok",
      "kind": "cliOutputPayload",
      "path": "cli-output/payload/compile.ok.schema.json",
      "$id": "https://schemas.mackysoft.dev/ucli/cli-output/payload/compile.ok.schema.json",
      "sha256": "f61a4e274b12344c336b542bcf3815a0cf89883bf64ded0dc32d4f3bc35d06b7",
      "command": "compile",
      "status": "ok",
      "usages": [],
      "staticDependencies": [],
      "dynamicValidationSources": []
    },
    {
      "name": "cli-output.payload.daemon.cleanup.error",
      "kind": "cliOutputPayload",
      "path": "cli-output/payload/daemon.cleanup.error.schema.json",
      "$id": "https://schemas.mackysoft.dev/ucli/cli-output/payload/daemon.cleanup.error.schema.json",
      "sha256": "d0cbff685553f38d78c789af223065a94b886b891d374aff8345b4d4eae5979e",
      "command": "daemon.cleanup",
      "status": "error",
      "usages": [],
      "staticDependencies": [],
      "dynamicValidationSources": []
    },
    {
      "name": "cli-output.payload.daemon.cleanup.ok",
      "kind": "cliOutputPayload",
      "path": "cli-output/payload/daemon.cleanup.ok.schema.json",
      "$id": "https://schemas.mackysoft.dev/ucli/cli-output/payload/daemon.cleanup.ok.schema.json",
      "sha256": "1ecf9ecc3e449e8d34491d6dd69b2e71a6845c0ef5fdf7cac996b6ee87b5d9cc",
      "command": "daemon.cleanup",
      "status": "ok",
      "usages": [],
      "staticDependencies": [],
      "dynamicValidationSources": []
    },
    {
      "name": "cli-output.payload.daemon.error",
      "kind": "cliOutputPayload",
      "path": "cli-output/payload/daemon.error.schema.json",
      "$id": "https://schemas.mackysoft.dev/ucli/cli-output/payload/daemon.error.schema.json",
      "sha256": "73edb94369e2c652ebfd5cf3ce11a897d79ac4ffdf74ad746e57abcc99d83203",
      "command": "daemon",
      "status": "error",
      "usages": [],
      "staticDependencies": [],
      "dynamicValidationSources": []
    },
    {
      "name": "cli-output.payload.daemon.list.error",
      "kind": "cliOutputPayload",
      "path": "cli-output/payload/daemon.list.error.schema.json",
      "$id": "https://schemas.mackysoft.dev/ucli/cli-output/payload/daemon.list.error.schema.json",
      "sha256": "277d635b8165e3d74f1b51ba36d580937a805e9b10006bbc429a20614b5863b1",
      "command": "daemon.list",
      "status": "error",
      "usages": [],
      "staticDependencies": [],
      "dynamicValidationSources": []
    },
    {
      "name": "cli-output.payload.daemon.list.ok",
      "kind": "cliOutputPayload",
      "path": "cli-output/payload/daemon.list.ok.schema.json",
      "$id": "https://schemas.mackysoft.dev/ucli/cli-output/payload/daemon.list.ok.schema.json",
      "sha256": "6e8f2bb872871a2e36395693dfc1cbaa593563974f361a4aa3a27ad864cb3977",
      "command": "daemon.list",
      "status": "ok",
      "usages": [],
      "staticDependencies": [],
      "dynamicValidationSources": []
    },
    {
      "name": "cli-output.payload.daemon.start.error",
      "kind": "cliOutputPayload",
      "path": "cli-output/payload/daemon.start.error.schema.json",
      "$id": "https://schemas.mackysoft.dev/ucli/cli-output/payload/daemon.start.error.schema.json",
      "sha256": "e83ad9e685e81750897ba31cf3baa4cc3f84de11095ad41c61178728f5bf9044",
      "command": "daemon.start",
      "status": "error",
      "usages": [],
      "staticDependencies": [],
      "dynamicValidationSources": []
    },
    {
      "name": "cli-output.payload.daemon.start.ok",
      "kind": "cliOutputPayload",
      "path": "cli-output/payload/daemon.start.ok.schema.json",
      "$id": "https://schemas.mackysoft.dev/ucli/cli-output/payload/daemon.start.ok.schema.json",
      "sha256": "091548cb8188ed139fb45e1a6157420e29b20349c5aff9bf735931d7ac805a18",
      "command": "daemon.start",
      "status": "ok",
      "usages": [],
      "staticDependencies": [],
      "dynamicValidationSources": []
    },
    {
      "name": "cli-output.payload.daemon.status.error",
      "kind": "cliOutputPayload",
      "path": "cli-output/payload/daemon.status.error.schema.json",